{
  "schema_version": 1,
  "repository": {
    "stable_id": "REPO-001",
    "github_id": "R_kgDOUCvfmg",
    "url": "https://github.com/shinyay/ghcp-with-gaming-ideation",
    "title": "shinyay/ghcp-with-gaming-ideation",
    "status": "active",
    "visibility": "private",
    "features": [
      "issues:enabled",
      "discussions:enabled",
      "wiki:enabled",
      "pages:unpublished"
    ]
  },
  "milestones": [
    {
      "stable_id": "MILESTONE-001",
      "github_id": "MI_kwDOUCvfms4BCk8h",
      "number": 1,
      "url": "https://github.com/shinyay/ghcp-with-gaming-ideation/milestone/1",
      "title": "Archive understanding",
      "status": "open"
    },
    {
      "stable_id": "MILESTONE-002",
      "github_id": "MI_kwDOUCvfms4BCk8j",
      "number": 2,
      "url": "https://github.com/shinyay/ghcp-with-gaming-ideation/milestone/2",
      "title": "Twin Span vertical slice",
      "status": "open"
    },
    {
      "stable_id": "MILESTONE-003",
      "github_id": "MI_kwDOUCvfms4BCk8k",
      "number": 3,
      "url": "https://github.com/shinyay/ghcp-with-gaming-ideation/milestone/3",
      "title": "Learning loop",
      "status": "open"
    }
  ],
  "issues": [
    {
      "stable_id": "ISSUE-001",
      "github_id": "I_kwDOUCvfms8AAAABOBnToA",
      "number": 1,
      "url": "https://github.com/shinyay/ghcp-with-gaming-ideation/issues/1",
      "title": "[ISSUE-001][VS-001] Active receiving thin proofを再検証する",
      "status": "open",
      "labels": [
        "area:gameplay",
        "demo:seed",
        "review:copilot-safe",
        "risk:reproducibility",
        "type:implementation"
      ],
      "milestone": "MILESTONE-002"
    },
    {
      "stable_id": "ISSUE-002",
      "github_id": "I_kwDOUCvfms8AAAABODKpRA",
      "number": 7,
      "url": "https://github.com/shinyay/ghcp-with-gaming-ideation/issues/7",
      "title": "[ISSUE-002][EVP-001] 384pxと320pxの速度関係を説明する",
      "status": "open",
      "labels": [
        "area:archive",
        "demo:seed",
        "review:copilot-safe",
        "review:human-required",
        "risk:reproducibility",
        "type:archive-question"
      ],
      "milestone": "MILESTONE-001"
    },
    {
      "stable_id": "ISSUE-003",
      "github_id": "I_kwDOUCvfms8AAAABODKp_g",
      "number": 8,
      "url": "https://github.com/shinyay/ghcp-with-gaming-ideation/issues/8",
      "title": "[ISSUE-003][EVP-002] 1996年のPlayer 2がtargetから外れた要因を切り分ける",
      "status": "open",
      "labels": [
        "area:archive",
        "demo:seed",
        "review:copilot-safe",
        "review:human-required",
        "risk:scope",
        "type:archive-question"
      ],
      "milestone": "MILESTONE-001"
    },
    {
      "stable_id": "ISSUE-004",
      "github_id": "I_kwDOUCvfms8AAAABODKqug",
      "number": 9,
      "url": "https://github.com/shinyay/ghcp-with-gaming-ideation/issues/9",
      "title": "[ISSUE-004][EVP-003] Return Passのaim処理の来歴を検証する",
      "status": "open",
      "labels": [
        "area:archive",
        "area:gameplay",
        "demo:seed",
        "review:copilot-safe",
        "review:human-required",
        "type:archive-question"
      ],
      "milestone": "MILESTONE-001"
    },
    {
      "stable_id": "ISSUE-005",
      "github_id": "I_kwDOUCvfms8AAAABODKrUA",
      "number": 10,
      "url": "https://github.com/shinyay/ghcp-with-gaming-ideation/issues/10",
      "title": "[ISSUE-005][EVP-007] RETURN音声cueの欠落経路を確認する",
      "status": "open",
      "labels": [
        "area:archive",
        "area:audio",
        "demo:seed",
        "review:copilot-safe",
        "review:human-required",
        "type:archive-question"
      ],
      "milestone": "MILESTONE-001"
    },
    {
      "stable_id": "ISSUE-006",
      "github_id": "I_kwDOUCvfms8AAAABODKsZw",
      "number": 11,
      "url": "https://github.com/shinyay/ghcp-with-gaming-ideation/issues/11",
      "title": "[ISSUE-006][CFL-004] CHAIN 30/32の不一致を保持して調べる",
      "status": "open",
      "labels": [
        "area:archive",
        "area:qa",
        "demo:seed",
        "review:copilot-safe",
        "review:human-required",
        "risk:reproducibility",
        "type:archive-question"
      ],
      "milestone": "MILESTONE-001"
    },
    {
      "stable_id": "ISSUE-007",
      "github_id": "I_kwDOUCvfms8AAAABODKs_A",
      "number": 12,
      "url": "https://github.com/shinyay/ghcp-with-gaming-ideation/issues/12",
      "title": "[ISSUE-007][CFL-003] 6 stageと8 table entriesの境界を確認する",
      "status": "open",
      "labels": [
        "area:archive",
        "area:qa",
        "demo:seed",
        "review:copilot-safe",
        "review:human-required",
        "type:archive-question"
      ],
      "milestone": "MILESTONE-001"
    },
    {
      "stable_id": "ISSUE-008",
      "github_id": "I_kwDOUCvfms8AAAABODKtjA",
      "number": 13,
      "url": "https://github.com/shinyay/ghcp-with-gaming-ideation/issues/13",
      "title": "[ISSUE-008][HYP-001] 能動的受領が感情的中核かを反証可能にする",
      "status": "open",
      "labels": [
        "area:design",
        "area:gameplay",
        "demo:seed",
        "review:copilot-safe",
        "review:human-required",
        "type:hypothesis"
      ],
      "milestone": "MILESTONE-002"
    },
    {
      "stable_id": "ISSUE-009",
      "github_id": "I_kwDOUCvfms8AAAABODKuCw",
      "number": 14,
      "url": "https://github.com/shinyay/ghcp-with-gaming-ideation/issues/14",
      "title": "[ISSUE-009][EXP-001] Design direction比較の中立な評価軸を定義する",
      "status": "open",
      "labels": [
        "area:design",
        "demo:seed",
        "review:copilot-safe",
        "review:human-required",
        "type:experiment"
      ],
      "milestone": "MILESTONE-002"
    },
    {
      "stable_id": "ISSUE-010",
      "github_id": "I_kwDOUCvfms8AAAABODKuiQ",
      "number": 15,
      "url": "https://github.com/shinyay/ghcp-with-gaming-ideation/issues/15",
      "title": "[ISSUE-010][VS-001] Twin Span vertical sliceを作業分解する",
      "status": "open",
      "labels": [
        "area:gameplay",
        "demo:seed",
        "review:human-required",
        "risk:scope",
        "type:epic"
      ],
      "milestone": "MILESTONE-002"
    },
    {
      "stable_id": "ISSUE-011",
      "github_id": "I_kwDOUCvfms8AAAABODKvAw",
      "number": 16,
      "url": "https://github.com/shinyay/ghcp-with-gaming-ideation/issues/16",
      "title": "[ISSUE-011][VS-001] Core handoff invariantを検証する",
      "status": "open",
      "labels": [
        "area:gameplay",
        "demo:seed",
        "review:copilot-safe",
        "risk:reproducibility",
        "type:implementation"
      ],
      "milestone": "MILESTONE-002"
    },
    {
      "stable_id": "ISSUE-012",
      "github_id": "I_kwDOUCvfms8AAAABODKvmg",
      "number": 17,
      "url": "https://github.com/shinyay/ghcp-with-gaming-ideation/issues/17",
      "title": "[ISSUE-012][VS-001] Receiver roleの能動性を検証する",
      "status": "open",
      "labels": [
        "area:gameplay",
        "demo:seed",
        "review:copilot-safe",
        "review:human-required",
        "type:implementation"
      ],
      "milestone": "MILESTONE-002"
    },
    {
      "stable_id": "ISSUE-013",
      "github_id": "I_kwDOUCvfms8AAAABODKwMg",
      "number": 18,
      "url": "https://github.com/shinyay/ghcp-with-gaming-ideation/issues/18",
      "title": "[ISSUE-013][VS-001] AI companionの入力境界を固定する",
      "status": "open",
      "labels": [
        "area:gameplay",
        "demo:seed",
        "review:human-required",
        "risk:scope",
        "type:implementation"
      ],
      "milestone": "MILESTONE-002"
    },
    {
      "stable_id": "ISSUE-014",
      "github_id": "I_kwDOUCvfms8AAAABODKwug",
      "number": 19,
      "url": "https://github.com/shinyay/ghcp-with-gaming-ideation/issues/19",
      "title": "[ISSUE-014][VS-001] Latency simulation fixturesを維持する",
      "status": "open",
      "labels": [
        "area:gameplay",
        "area:platform",
        "demo:seed",
        "review:copilot-safe",
        "risk:reproducibility",
        "type:implementation"
      ],
      "milestone": "MILESTONE-002"
    },
    {
      "stable_id": "ISSUE-015",
      "github_id": "I_kwDOUCvfms8AAAABODKxZA",
      "number": 20,
      "url": "https://github.com/shinyay/ghcp-with-gaming-ideation/issues/20",
      "title": "[ISSUE-015][VS-001] Art readabilityを検証する",
      "status": "open",
      "labels": [
        "area:art",
        "demo:seed",
        "review:copilot-safe",
        "review:human-required",
        "type:implementation"
      ],
      "milestone": "MILESTONE-002"
    },
    {
      "stable_id": "ISSUE-016",
      "github_id": "I_kwDOUCvfms8AAAABODKyVA",
      "number": 21,
      "url": "https://github.com/shinyay/ghcp-with-gaming-ideation/issues/21",
      "title": "[ISSUE-016][VS-001] Audio layersの状態対応を検証する",
      "status": "open",
      "labels": [
        "area:audio",
        "demo:seed",
        "review:copilot-safe",
        "review:human-required",
        "type:implementation"
      ],
      "milestone": "MILESTONE-002"
    },
    {
      "stable_id": "ISSUE-017",
      "github_id": "I_kwDOUCvfms8AAAABODKzJg",
      "number": 22,
      "url": "https://github.com/shinyay/ghcp-with-gaming-ideation/issues/22",
      "title": "[ISSUE-017][VS-001] Accessibility input pathを確認する",
      "status": "open",
      "labels": [
        "area:gameplay",
        "demo:seed",
        "review:copilot-safe",
        "review:human-required",
        "type:implementation"
      ],
      "milestone": "MILESTONE-002"
    },
    {
      "stable_id": "ISSUE-018",
      "github_id": "I_kwDOUCvfms8AAAABODK0Gw",
      "number": 23,
      "url": "https://github.com/shinyay/ghcp-with-gaming-ideation/issues/23",
      "title": "[ISSUE-018][VS-001] Replay equivalence testsを維持する",
      "status": "open",
      "labels": [
        "area:platform",
        "area:qa",
        "demo:seed",
        "review:copilot-safe",
        "risk:reproducibility",